label,cond1,cond2,cond3,cond4,item,sentence,comprehension_question,answerchoice0,answerchoice1,correct_response,group
chow_sub_low_227_9,chow,sub,low,9,227,The scribe recorded which rebels the monarch had rewarded for their actions.,Who rewarded the rebels for their actions?,the monarch,the police,0,list2
chow_sub_high_228_9,chow,sub,high,9,228,The teacher remembered which delinquent the principal had suspended for a week.,Who did the principal suspend?,a teacher,a delinquent,1,list2
chow_sub_low_228_9,chow,sub,low,9,228,The teacher remembered which overachiever the principal had suspended for a week.,Who did the principal suspend?,a teacher,an overachiever,1,list1
chow_sub_high_229_8,chow,sub,high,8,229,Sally heard which patient the doctor had treated first thing this morning.,When did the doctor treat the patient?,first thing this morning,last night,0,list1
chow_sub_low_229_8,chow,sub,low,8,229,Sally heard which nurse the doctor had treated first thing this morning.,when did the doctor treat the nurse ?,first thing this morning,last night,0,list2
chow_sub_high_230_10,chow,sub,high,10,230,The beach bum saw which fish the seagulls had caught along the beach.,Did the seagulls eat french fries?,yes,no ,1,list3
chow_sub_low_230_10,chow,sub,low,10,230,The beach bum saw which picnickers the seagulls had caught along the beach.,Did the seagulls eat french fries?,yes,no ,1,list4
chow_sub_high_231_9,chow,sub,high,9,231,The circus-goer explained which juggler the clown had tripped in the center ring.,,,,,list4
chow_sub_low_231_9,chow,sub,low,9,231,The circus-goer explained which child the clown had tripped in the center ring.,,,,,list3
chow_sub_high_232_10,chow,sub,high,10,232,The football fan heard which cheerleader the quarterback had dated after the season.,,,,,list3
chow_sub_low_232_10,chow,sub,low,10,232,The football fan heard which linebacker the quarterback had dated after the season.,,,,,list4
chow_sub_high_233_10,chow,sub,high,10,233,The seasonal laborer marked which cows the farmer had milked early this morning.,,,,,list4
chow_sub_low_233_10,chow,sub,low,10,233,The seasonal laborer marked which chickens the farmer had milked early this morning.,,,,,list3
chow_sub_high_234_9,chow,sub,high,9,234,The secretary knew which manager the CEO had promoted from the old office.,Who did the CEO promote from the old office?,a manager,a custodian,0,list3
chow_sub_low_234_9,chow,sub,low,9,234,The secretary knew which investor the CEO had promoted from the old office.,Who did the CEO promote from the old office?,an investor,a custodian,0,list4
chow_sub_high_235_9,chow,sub,high,9,235,General Jones heard which terrorist the corporal had captured during the battle.,,,,,list4
chow_sub_low_235_9,chow,sub,low,9,235,General Jones heard which comrade the corporal had captured during the battle.,,,,,list3
chow_sub_high_236_8,chow,sub,high,8,236,Jason saw which nerd the teacher had praised for his good behavior.,,,,,list3
chow_sub_low_236_8,chow,sub,low,8,236,Jason saw which rascal the teacher had praised for his good behavior.,,,,,list4
chow_sub_high_237_8,chow,sub,high,8,237,Jim forgot which addict the therapist had treated in his last session.,,,,,list4
chow_sub_low_237_8,chow,sub,low,8,237,Jim forgot which doctor the therapist had treated in his last session.,,,,,list3
chow_sub_high_238_9,chow,sub,high,9,238,The announcer stated which teammate the player had replaced for the upcoming game.,,,,,list3
chow_sub_low_238_9,chow,sub,low,9,238,The announcer stated which rival the player had replaced for the upcoming game.,,,,,list4
chow_sub_high_239_11,chow,sub,high,11,239,The crafts fair manager asked which cows the leatherworker had skinned to make his bags.,,,,,list4
chow_sub_low_239_11,chow,sub,low,11,239,The crafts fair manager asked which customers the leatherworker had skinned to make his bags.,,,,,list3
chow_sub_high_240_10,chow,sub,high,10,240,The police woman recognized which officer the lieutenant had promoted to a higher position.,,,,,list3
chow_sub_low_240_10,chow,sub,low,10,240,The police woman recognized which thief the lieutenant had promoted to a higher position.,,,,,list4
chow_sub_high_241_9,chow,sub,high,9,241,The reviewer forgot which researchers the authors had cited in their paper.,,,,,list4
chow_sub_low_241_9,chow,sub,low,9,241,The reviewer forgot which mice the authors had cited in their paper.,,,,,list3
chow_sub_high_242_11,chow,sub,high,11,242,The swim team captain recalled which champion the swimmer had defeated at last week's race.,When was the race?,last year,last week,1,list3
chow_sub_low_242_11,chow,sub,low,11,242,The swim team captain recalled which lifeguard the swimmer had defeated at last week's race.,When was the race?,last year,last week,1,list4
chow_sub_high_243_9,chow,sub,high,9,243,The zoologist marked which pup the seal had birthed over the weekend.,,,,,list4
chow_sub_low_243_9,chow,sub,low,9,243,The zoologist marked which walrus the seal had birthed over the weekend.,,,,,list3
chow_sub_high_244_9,chow,sub,high,9,244,The captain realized which stowaway the sailor had hidden in the cargo hold.,Was someone hidden in the cargo hold?,yes,no,0,list3
chow_sub_low_244_9,chow,sub,low,9,244,The captain realized which pirate the sailor had hidden in the cargo hold.,Was someone hidden in the cargo hold?,yes,no,0,list4
chow_sub_high_245_9,chow,sub,high,9,245,The father recalled which girl the boy had dated in junior high.,,,,,list4
chow_sub_low_245_9,chow,sub,low,9,245,The father recalled which dog the boy had dated in junior high.,,,,,list3
chow_sub_high_246_10,chow,sub,high,10,246,The Japanese scientists showed which salespeople the robots had replaced in the last decade.,,,,,list3
chow_sub_low_246_10,chow,sub,low,10,246,The Japanese scientists showed which patients the robots had replaced in the last decade.,,,,,list4
chow_sub_high_247_9,chow,sub,high,9,247,The principal forgot which student the teacher had disciplined after school yesterday.,,,,,list4
chow_sub_low_247_9,chow,sub,low,9,247,The principal forgot which parent the teacher had disciplined after school yesterday.,,,,,list3
chow_sub_high_248_9,chow,sub,high,9,248,The shepherd saw which lamb the sheep had birthed by the barn.,,,,,list3
chow_sub_low_248_9,chow,sub,low,9,248,The shepherd saw which predator the sheep had birthed by the barn.,,,,,list4
chow_sub_high_249_9,chow,sub,high,9,249,The snoop determined which bouncer the alcoholic had punched last Friday night.,,,,,list4
chow_sub_low_249_9,chow,sub,low,9,249,The snoop determined which psychologist the alcoholic had punched last Friday night.,,,,,list3
chow_sub_high_250_8,chow,sub,high,8,250,Carla inquired which exterminator the landlord had used in the apartment.,,,,,list3
chow_sub_low_250_8,chow,sub,low,8,250,Carla inquired which neighbor the landlord had used in the apartment.,,,,,list4
chow_sub_high_251_8,chow,sub,high,8,251,Karen learned which teenager the mother had grounded for disobeying her.,,,,,list4
chow_sub_low_251_8,chow,sub,low,8,251,Karen learned which baby the mother had grounded for disobeying her.,,,,,list3
chow_sub_high_252_8,chow,sub,high,8,252,Sandra observed which biologists the zookeeper had consulted about the food.,What did the zookeeper consult about?,the habitat,the food,1,list3
chow_sub_low_252_8,chow,sub,low,8,252,Sandra observed which gorillas the zookeeper had consulted about the food.,What did the zookeeper consult about?,the habitat,the food,1,list4
chow_sub_high_253_9,chow,sub,high,9,253,The anthropologist discovered which animal the caveman had hunted with flint arrows.,What did the caveman do?,hunt with arrows,go to sleep,0,list4
chow_sub_low_253_9,chow,sub,low,9,253,The anthropologist discovered which goddess the caveman had hunted with flint arrows.,What did the caveman do?,hunt with arrows,go to sleep,0,list3
chow_sub_high_254_9,chow,sub,high,9,254,The mother wondered which trick-or-treaters the neighbor had scared with his costume.,Who was scared by the neighbors costume?,a dog,trick-or-treaters,1,list3
chow_sub_low_254_9,chow,sub,low,9,254,The mother wondered which milkman the neighbor had scared with his costume.,Who was scared by the neighbors costume?,a dog,a milkman,1,list4
chow_sub_high_255_10,chow,sub,high,10,255,The movie buff speculated which actor the stuntman had portrayed in the opening scene.,Which scene is the stuntman in?,the opening scene,the final scene,0,list4
chow_sub_low_255_10,chow,sub,low,10,255,The movie buff speculated which director the stuntman had portrayed in the opening scene.,Which scene is the stuntman in?,the opening scene,the final scene,0,list3
chow_sub_high_256_9,chow,sub,high,9,256,The researcher recorded which chimpanzee the biologist had tagged to be studied.,What did the researcher do?,wrote a paper,recorded a tag,1,list3
chow_sub_low_256_9,chow,sub,low,9,256,The researcher recorded which assistant the biologist had tagged to be studied.,What did the researcher do?,wrote a paper,recorded a tag,1,list4
chow_sub_high_257_9,chow,sub,high,9,257,The sentry knew which guard the captain had fired from the position.,,,,,list4
chow_sub_low_257_9,chow,sub,low,9,257,The sentry knew which townsperson the captain had fired from the position.,,,,,list3
chow_sub_high_258_10,chow,sub,high,10,258,The team manager knew which athlete the officials had penalized for being unsportsmanlike.,Who was punished for being unsportsmanlike?,an athlete,a fan,0,list3
chow_sub_low_258_10,chow,sub,low,10,258,The team manager knew which umpire the officials had penalized for being unsportsmanlike.,Who was punished for being unsportsmanlike?,an umpire,a fan,0,list4
chow_sub_high_259_10,chow,sub,high,10,259,The theater owner described which spectators the magician had amazed with his tricks.,,,,,list4
chow_sub_low_259_10,chow,sub,low,10,259,The theater owner described which rabbit the magician had amazed with his tricks.,,,,,list3
kutas_low_rel_eq_301,kutas,low,rel,eq,301,She put on her high heeled boots for the party.,What high heels did she put on for the party?,boots,shoes,0,list1
kutas_high_best_eq_301,kutas,high,best,eq,301,She put on her high heeled shoes for the party.,What high heels did she put on for the party?,shoes,boots,0,list2
kutas_low_rel_eq_301,kutas,low,rel,eq,301,She put on her high heeled boots for the party.,What high heels did she put on for the party?,boots,shoes,0,list3
kutas_high_best_eq_301,kutas,high,best,eq,301,She put on her high heeled shoes for the party.,What high heels did she put on for the party?,boots,shoes,1,list4
kutas_high_best_bestlonger_302,kutas,high,best,bestlonger,302,The cub scouts needed a new den mother to lead them.,Who needed someone to lead them?,the cub scouts,the kids,0,list2
kutas_low_unrel_bestlonger_302,kutas,low,unrel,bestlonger,302,The cub scouts needed a new den chair to lead them.,Who needed someone to lead them?,the cub scouts,the kids,0,list1
kutas_high_best_bestlonger_302,kutas,high,best,bestlonger,302,The cub scouts needed a new den mother to lead them.,Who needed someone to lead them?,the cub scouts,the kids,0,list4
kutas_low_unrel_bestlonger_302,kutas,low,unrel,bestlonger,302,The cub scouts needed a new den chair to lead them.,Who needed someone to lead them?,the cub scouts,the kids,0,list3
kutas_low_rel_bestshorter_304,kutas,low,rel,bestshorter,304,The pizza was too hot to chew right away.,What food was too hot?,pizza,soup,0,list1
kutas_high_best_bestshorter_304,kutas,high,best,bestshorter,304,The pizza was too hot to eat right away.,What food was too hot?,pizza,soup,0,list2
kutas_low_rel_bestshorter_304,kutas,low,rel,bestshorter,304,The pizza was too hot to chew right away.,What food was too hot?,pizza,soup,0,list3
kutas_high_best_bestshorter_304,kutas,high,best,bestshorter,304,The pizza was too hot to eat right away.,What food was too hot?,pizza,soup,0,list4
kutas_low_rel_bestshorter_307,kutas,low,rel,bestshorter,307,The ship disappeared into the thick mist out of sight.,Where did the ship go?,into the mist,into the fog,0,list2
kutas_high_best_bestshorter_307,kutas,high,best,bestshorter,307,The ship disappeared into the thick fog out of sight.,Where did the ship go?,into the mist,into the fog,1,list1
kutas_low_rel_bestshorter_307,kutas,low,rel,bestshorter,307,The ship disappeared into the thick mist out of sight.,Where did the ship go?,into the mist,into the fog,0,list4
kutas_high_best_bestshorter_307,kutas,high,best,bestshorter,307,The ship disappeared into the thick fog out of sight.,Where did the ship go?,into the mist,into the fog,1,list3
kutas_low_rel_bestshorter_308,kutas,low,rel,bestshorter,308,Nothing can beat a bowl of hot broth in winter.,What can't be beat in winter?,hot broth,hot soup,0,list1
kutas_high_best_bestshorter_308,kutas,high,best,bestshorter,308,Nothing can beat a bowl of hot soup in winter.,What can't be beat in winter?,hot broth,hot soup,1,list2
kutas_low_rel_bestshorter_308,kutas,low,rel,bestshorter,308,Nothing can beat a bowl of hot broth in winter.,What can't be beat in winter?,hot broth,hot soup,0,list3
kutas_high_best_bestshorter_308,kutas,high,best,bestshorter,308,Nothing can beat a bowl of hot soup in winter.,What can't be beat in winter?,hot broth,hot soup,1,list4
kutas_low_rel_eq_310,kutas,low,rel,eq,310,The dirty clothes were piled up in the laundry hamper in the laundry room.,Where were the dirty clothes piled?,in the hamper,in the basket,0,list2
kutas_high_best_eq_310,kutas,high,best,eq,310,The dirty clothes were piled up in the laundry basket in the laundry room.,Where were the dirty clothes piled?,in the hamper,in the basket,1,list1
kutas_low_rel_eq_310,kutas,low,rel,eq,310,The dirty clothes were piled up in the laundry hamper in the laundry room.,Where were the dirty clothes piled?,in the hamper,in the basket,0,list4
kutas_high_best_eq_310,kutas,high,best,eq,310,The dirty clothes were piled up in the laundry basket in the laundry room.,Where were the dirty clothes piled?,in the hamper,in the basket,1,list3
kutas_low_unrel_bestlonger_313,kutas,low,unrel,bestlonger,313,She's afraid of deep water because she can't see in it.,Is she afraid of deep water?,yes,no,0,list1
kutas_high_best_bestlonger_313,kutas,high,best,bestlonger,313,She's afraid of deep water because she can't swim in it.,Is she afraid of deep water?,yes,no,0,list2
kutas_low_unrel_bestlonger_313,kutas,low,unrel,bestlonger,313,She's afraid of deep water because she can't see in it.,Is she afraid of deep water?,yes,no,0,list3
kutas_high_best_bestlonger_313,kutas,high,best,bestlonger,313,She's afraid of deep water because she can't swim in it.,Is she afraid of deep water?,yes,no,0,list4
kutas_low_unrel_eq_314,kutas,low,unrel,eq,314,One of the scouts did not know the way and got hurt along the way.,What happened to the scout?,they got hurt,they got lost,0,list1
kutas_high_best_eq_314,kutas,high,best,eq,314,One of the scouts did not know the way and got lost along the way.,What happened to the scout?,they got hurt,they got lost,1,list2
kutas_low_unrel_eq_314,kutas,low,unrel,eq,314,One of the scouts did not know the way and got hurt along the way.,What happened to the scout?,they got hurt,they got lost,0,list3
kutas_high_best_eq_314,kutas,high,best,eq,314,One of the scouts did not know the way and got lost along the way.,What happened to the scout?,they got hurt,they got lost,1,list4
kutas_low_rel_bestlonger_318,kutas,low,rel,bestlonger,318,They heated the pool with solar power in the winter.,When did they heat the pool?,in the winter,in the summer,0,list2
kutas_high_best_bestlonger_318,kutas,high,best,bestlonger,318,They heated the pool with solar energy in the winter.,When did they heat the pool?,in the winter,in the summer,0,list1
kutas_low_rel_bestlonger_318,kutas,low,rel,bestlonger,318,They heated the pool with solar power in the winter.,When did they heat the pool?,in the winter,in the summer,0,list4
kutas_high_best_bestlonger_318,kutas,high,best,bestlonger,318,They heated the pool with solar energy in the winter.,When did they heat the pool?,in the winter,in the summer,0,list3
kutas_low_unrel_bestlonger_319,kutas,low,unrel,bestlonger,319,The baby weighed six pounds at noon in the hospital.,How much did the baby weigh?,six pounds,six tons,0,list1
kutas_high_best_bestlonger_319,kutas,high,best,bestlonger,319,The baby weighed six pounds at birth in the hospital.,How much did the baby weigh?,six pounds,six tons,0,list2
kutas_low_unrel_bestlonger_319,kutas,low,unrel,bestlonger,319,The baby weighed six pounds at noon in the hospital.,How much did the baby weigh?,six pounds,six tons,0,list3
kutas_high_best_bestlonger_319,kutas,high,best,bestlonger,319,The baby weighed six pounds at birth in the hospital.,How much did the baby weigh?,six pounds,six tons,0,list4
kutas_low_unrel_eq_320,kutas,low,unrel,eq,320,I added my name to the top of the wall of awards.,Where did I add my name?,the top of the wall,the top of the list,0,list2
kutas_high_best_eq_320,kutas,high,best,eq,320,I added my name to the top of the list of awards.,Where did I add my name?,the top of the wall,the top of the list,1,list1
kutas_low_unrel_eq_320,kutas,low,unrel,eq,320,I added my name to the top of the wall of awards.,Where did I add my name?,the top of the wall,the top of the list,0,list4
kutas_high_best_eq_320,kutas,high,best,eq,320,I added my name to the top of the list of awards.,Where did I add my name?,the top of the wall,the top of the list,1,list3
kutas_low_rel_bestshorter_323,kutas,low,rel,bestshorter,323,The clerk put the groceries in the shopping carts for the customers.,Who moved the groceries?,the clerk,the customers,0,list2
kutas_high_best_bestshorter_323,kutas,high,best,bestshorter,323,The clerk put the groceries in the shopping bags for the customers.,Who moved the groceries?,the clerk,the customers,0,list1
kutas_low_rel_bestshorter_323,kutas,low,rel,bestshorter,323,The clerk put the groceries in the shopping carts for the customers.,Who moved the groceries?,the clerk,the customers,0,list4
kutas_high_best_bestshorter_323,kutas,high,best,bestshorter,323,The clerk put the groceries in the shopping bags for the customers.,Who moved the groceries?,the clerk,the customers,0,list3
kutas_low_unrel_eq_326,kutas,low,unrel,eq,326,The prisoners were planning their picnic on the sunny day.,What were the prisoners planning?,their picnic,their escape,0,list1
kutas_high_best_eq_326,kutas,high,best,eq,326,The prisoners were planning their escape on the sunny day.,What were the prisoners planning?,their picnic,their escape,1,list2
kutas_low_unrel_eq_326,kutas,low,unrel,eq,326,The prisoners were planning their picnic on the sunny day.,What were the prisoners planning?,their picnic,their escape,0,list3
kutas_high_best_eq_326,kutas,high,best,eq,326,The prisoners were planning their escape on the sunny day.,What were the prisoners planning?,their picnic,their escape,1,list4
kutas_low_rel_bestlonger_328,kutas,low,rel,bestlonger,328,The office held a new year's eve bash that night.,Where was the new year celebrated?,the office,the church,0,list2
kutas_high_best_bestlonger_328,kutas,high,best,bestlonger,328,The office held a new year's eve party that night.,Where was the new year celebrated?,the office,the church,0,list1
kutas_low_rel_bestlonger_328,kutas,low,rel,bestlonger,328,The office held a new year's eve bash that night.,Where was the new year celebrated?,the office,the church,0,list4
kutas_high_best_bestlonger_328,kutas,high,best,bestlonger,328,The office held a new year's eve party that night.,Where was the new year celebrated?,the office,the church,0,list3
kutas_low_unrel_eq_331,kutas,low,unrel,eq,331,They went as far as they dared on the path.,How far did they go?,as far as they dared,as far as they could,0,list2
kutas_high_best_eq_331,kutas,high,best,eq,331,They went as far as they could on the path.,How far did they go?,as far as they dared,as far as they could,1,list1
kutas_low_unrel_eq_331,kutas,low,unrel,eq,331,They went as far as they dared on the path.,How far did they go?,as far as they dared,as far as they could,0,list4
kutas_high_best_eq_331,kutas,high,best,eq,331,They went as far as they could on the path.,How far did they go?,as far as they dared,as far as they could,1,list3
kutas_low_unrel_eq_332,kutas,low,unrel,eq,332,Mary looked at her watch to check the band on her wrist.,Why did Mary look at her watch?,to check the band,to check the time,0,list1
kutas_high_best_eq_332,kutas,high,best,eq,332,Mary looked at her watch to check the time on her wrist.,Why did Mary look at her watch?,to check the band,to check the time,1,list2
kutas_low_unrel_eq_332,kutas,low,unrel,eq,332,Mary looked at her watch to check the band on her wrist.,Why did Mary look at her watch?,to check the band,to check the time,0,list3
kutas_high_best_eq_332,kutas,high,best,eq,332,Mary looked at her watch to check the time on her wrist.,Why did Mary look at her watch?,to check the band,to check the time,1,list4
kutas_low_unrel_eq_340,kutas,low,unrel,eq,340,"The barbells the strong man lifted were very rusty, but he did it.",What were the barbells the strong man lifted?,rusty,heavy,0,list2
kutas_high_best_eq_340,kutas,high,best,eq,340,"The barbells the strong man lifted were very heavy, but he did it.",What were the barbells the strong man lifted?,rusty,heavy,1,list1
kutas_low_unrel_eq_340,kutas,low,unrel,eq,340,"The barbells the strong man lifted were very rusty, but he did it.",What were the barbells the strong man lifted?,rusty,heavy,0,list4
kutas_high_best_eq_340,kutas,high,best,eq,340,"The barbells the strong man lifted were very heavy, but he did it.",What were the barbells the strong man lifted?,rusty,heavy,1,list3
kutas_low_rel_eq_341,kutas,low,rel,eq,341,He studied a long time so he would pass his tests and get his degree.,Did he study a long time to get his degree?,yes,no,0,list1
kutas_high_best_eq_341,kutas,high,best,eq,341,He studied a long time so he would pass his exams and get his degree.,Did he study a long time to get his degree?,yes,no,0,list2
kutas_low_rel_eq_341,kutas,low,rel,eq,341,He studied a long time so he would pass his tests and get his degree.,Did he study a long time to get his degree?,yes,no,0,list3
kutas_high_best_eq_341,kutas,high,best,eq,341,He studied a long time so he would pass his exams and get his degree.,Did he study a long time to get his degree?,yes,no,0,list4
kutas_low_unrel_bestlonger_353,kutas,low,unrel,bestlonger,353,On hot days many people sun themselves on the roof near their homes.,When do many people sun themselves?,on hot days,on cold days,0,list2
kutas_high_best_bestlonger_353,kutas,high,best,bestlonger,353,On hot days many people sun themselves on the beach near their homes.,When do many people sun themselves?,on hot days,on cold days,0,list1
kutas_low_unrel_bestlonger_353,kutas,low,unrel,bestlonger,353,On hot days many people sun themselves on the roof near their homes.,When do many people sun themselves?,on hot days,on cold days,0,list4
kutas_high_best_bestlonger_353,kutas,high,best,bestlonger,353,On hot days many people sun themselves on the beach near their homes.,When do many people sun themselves?,on hot days,on cold days,0,list3
kutas_low_unrel_eq_354,kutas,low,unrel,eq,354,John was so exhausted he took a vacation to get some help for a while.,How was John feeling?,exhausted,elated,0,list2
kutas_high_best_eq_354,kutas,high,best,eq,354,John was so exhausted he took a vacation to get some rest for a while.,How was John feeling?,exhausted,elated,0,list1
kutas_low_unrel_eq_354,kutas,low,unrel,eq,354,John was so exhausted he took a vacation to get some help for a while.,How was John feeling?,exhausted,elated,0,list4
kutas_high_best_eq_354,kutas,high,best,eq,354,John was so exhausted he took a vacation to get some rest for a while.,How was John feeling?,exhausted,elated,0,list3
kutas_low_rel_bestlonger_355,kutas,low,rel,bestlonger,355,William went to the bank to borrow some cash for his friend.,Where did William go?,to the shop,to the bank,1,list1
kutas_high_best_bestlonger_355,kutas,high,best,bestlonger,355,William went to the bank to borrow some money for his friend.,Where did William go?,to the shop,to the bank,1,list2
kutas_low_rel_bestlonger_355,kutas,low,rel,bestlonger,355,William went to the bank to borrow some cash for his friend.,Where did William go?,to the shop,to the bank,1,list3
kutas_high_best_bestlonger_355,kutas,high,best,bestlonger,355,William went to the bank to borrow some money for his friend.,Where did William go?,to the shop,to the bank,1,list4
kutas_low_rel_bestshorter_362,kutas,low,rel,bestshorter,362,The movers put the sofa on the bare ground.,Who put the sofa down?,the movers,the tenants,0,list1
kutas_high_best_bestshorter_362,kutas,high,best,bestshorter,362,The movers put the sofa on the bare floor.,Who put the sofa down?,the movers,the tenants,0,list2
kutas_low_rel_bestshorter_362,kutas,low,rel,bestshorter,362,The movers put the sofa on the bare ground.,Who put the sofa down?,the movers,the tenants,0,list3
kutas_high_best_bestshorter_362,kutas,high,best,bestshorter,362,The movers put the sofa on the bare floor.,Who put the sofa down?,the movers,the tenants,0,list4
kutas_low_unrel_bestshorter_365,kutas,low,unrel,bestshorter,365,The whole town came to hear the mayor resign.,Who came to hear the mayor?,nobody,the whole town,1,list2
kutas_high_best_bestshorter_365,kutas,high,best,bestshorter,365,The whole town came to hear the mayor speak.,Who came to hear the mayor?,nobody,the whole town,1,list1
kutas_low_unrel_bestshorter_365,kutas,low,unrel,bestshorter,365,The whole town came to hear the mayor resign.,Who came to hear the mayor?,nobody,the whole town,1,list4
kutas_high_best_bestshorter_365,kutas,high,best,bestshorter,365,The whole town came to hear the mayor speak.,Who came to hear the mayor?,nobody,the whole town,1,list3
kutas_low_rel_eq_374,kutas,low,rel,eq,374,The tenants were evicted when they did not pay the last month's bill to the landlord.,Who were the tenants supposed to pay?,the landlord,the realtor,0,list1
