label,cond1,cond2,cond3,cond4,item,sentence,comprehension_question,answerchoice0,answerchoice1,correct_response,group
chow_rev_high_100_10,chow,rev,high,10,100,The travel agent recorded which innkeeper the guests had liked in his notebook.,,,,,list1
chow_rev_low_100_10,chow,rev,low,10,100,The travel agent recorded which guests the innkeeper had liked in his notebook.,,,,,list2
chow_rev_high_101_10,chow,rev,high,10,101,The trapeze artist indicated which lion the trainer had tamed for the circus.,Who did the trainer tame for the circus?,a lion,a zebra,0,list2
chow_rev_low_101_10,chow,rev,low,10,101,The trapeze artist indicated which trainer the lion had tamed for the circus.,Who did the lion tame for the circus?,a clown,a trainer,1,list1
chow_rev_high_102_10,chow,rev,high,10,102,The birthday boy saw which friend the clown had scared at the party.,Did the clown scare someone at the party?,yes,no,0,list1
chow_rev_low_102_10,chow,rev,low,10,102,The birthday boy saw which clown the friend had scared at the party.,Did the clown scare someone at the party?,yes,no,0,list2
chow_rev_high_103_10,chow,rev,high,10,103,The opera composer revealed which pirate the singer had portrayed with the greatest finesse.,What did the opera composer do?,reveal,dance,0,list2
chow_rev_low_103_10,chow,rev,low,10,103,The opera composer revealed which singer the pirate had portrayed with the greatest finesse.,What did the opera composer do?,reveal,dance,0,list1
chow_rev_high_104_9,chow,rev,high,9,104,The newscaster confirmed which fugitive the policeman had arrested following the robbery.,What did the newscaster do?,arrest,confirm,1,list1
chow_rev_low_104_9,chow,rev,low,9,104,The newscaster confirmed which policeman the fugitive had arrested following the robbery.,What did the newscaster do?,arrest,confirm,1,list2
chow_rev_high_105_10,chow,rev,high,10,105,The royal cook asked which lord the chef had served for twenty years.,How long did the chef serve?,twenty years,fifteen years,0,list2
chow_rev_low_105_10,chow,rev,low,10,105,The royal cook asked which chef the lord had served for twenty years.,How long did the lord serve?,twenty years,fifteen years,0,list1
chow_rev_high_106_10,chow,rev,high,10,106,The family counselor understood which daughter the stepparent had abused on a daily basis.,,,,,list1
chow_rev_low_106_10,chow,rev,low,10,106,The family counselor understood which stepparent the daughter had abused on a daily basis.,,,,,list2
chow_rev_high_107_10,chow,rev,high,10,107,The art critic identified which model the artist had drawn in the studio.,Where did the artist draw?,outside,in the studio,1,list2
chow_rev_low_107_10,chow,rev,low,10,107,The art critic identified which artist the model had drawn in the studio.,Where did the model draw?,outside,in the studio,1,list1
chow_rev_high_108_10,chow,rev,high,10,108,The wildlife curator mentioned which ape the zookeeper had fed some fresh fruit.,Who did the zookeeper feed fresh fruit?,an ape,a rhinoceros,0,list1
chow_rev_low_108_10,chow,rev,low,10,108,The wildlife curator mentioned which zookeeper the ape had fed some fresh fruit.,Who did the ape feed fresh fruit?,a rhinoceros,a zookeeper,1,list2
chow_rev_high_109_10,chow,rev,high,10,109,The costume designer confirmed which actor the barber had shaved for the part.,Who did the barber shave for the part?,an actor,a director,0,list2
chow_rev_low_109_10,chow,rev,low,10,109,The costume designer confirmed which barber the actor had shaved for the part.,Who did the barber shave for the part?,a director,an actor,1,list1
chow_rev_high_110_9,chow,rev,high,9,110,The investigator discovered which couple the abductor had taken during their vacation.,,,,,list1
chow_rev_low_110_9,chow,rev,low,9,110,The investigator discovered which abductor the couple had taken during their vacation.,,,,,list2
chow_rev_high_111_9,chow,rev,high,9,111,The librarian documented which celebrities the journalist had interviewed for the magazine.,What did the librarian do?,document,type,0,list2
chow_rev_low_111_9,chow,rev,low,9,111,The librarian documented which journalist the celebrities had interviewed for the magazine.,What did the librarian do?,document,type,0,list1
chow_rev_high_112_9,chow,rev,high,9,112,The historian documented which prince the assassin had killed in the 10th century.,What did the assasin do?,kill,jump,0,list1
chow_rev_low_112_9,chow,rev,low,9,112,The historian documented which assassin the prince had killed in the 10th century.,What did the assasin do?,jump,document,1,list2
chow_rev_high_113_9,chow,rev,high,9,113,The broadcaster explained which contestant the judge had disqualified from the show.,Was someone disqualified from the show?,yes,no,0,list2
chow_rev_low_113_9,chow,rev,low,9,113,The broadcaster explained which judge the contestant had disqualified from the show.,Was someone disqualified from the show?,yes,no,0,list1
chow_rev_high_115_10,chow,rev,high,10,115,The security guard investigated which patrolman the loiterer had evaded for three hours.,Did the loiterer evade the patrolman for five hours?,yes,no,1,list1
chow_rev_low_115_10,chow,rev,low,10,115,The security guard investigated which loiterer the patrolman had evaded for three hours.,Did the patrolman evade the loiterer for five hours?,yes,no,1,list2
chow_rev_high_116_9,chow,rev,high,9,116,The farmer indicated which donkey the townsperson had bought in the neighboring village.,Which animal was involved in this sentence?,a bird,a donkey,1,list2
chow_rev_low_116_9,chow,rev,low,9,116,The farmer indicated which townsperson the donkey had bought in the neighboring village.,Which animal was involved in this sentence?,a bird,a donkey,1,list1
chow_rev_high_117_9,chow,rev,high,9,117,The reporter inquired which animals the groomer had cleaned with special shampoo.,How were the animals cleaned?,with special shampoo,with a bath,0,list1
chow_rev_low_117_9,chow,rev,low,9,117,The reporter inquired which groomer the animals had cleaned with special shampoo.,How were the animals cleaned?,with special shampoo,with a bath,0,list2
chow_rev_high_118_10,chow,rev,high,10,118,The dance instructor noticed which onlookers the performers had impressed in the audience.,Was the audience impressed?,yes,no,0,list2
chow_rev_low_118_10,chow,rev,low,10,118,The dance instructor noticed which performers the onlookers had impressed in the audience.,Was the audience impressed?,yes,no,0,list1
chow_rev_high_119_10,chow,rev,high,10,119,The jail keeper forgot which guard the prisoner had attacked in his cell.,,,,,list1
chow_rev_low_119_10,chow,rev,low,10,119,The jail keeper forgot which prisoner the guard had attacked in his cell.,,,,,list2
chow_rev_high_120_10,chow,rev,high,10,120,The Indian king identified which prince the elephant had trampled during the long journey.,,,,,list2
chow_rev_low_120_10,chow,rev,low,10,120,The Indian king identified which elephant the prince had trampled during the long journey.,,,,,list1
chow_rev_high_121_10,chow,rev,high,10,121,The undead king recognized which woman the zombie had bitten during the fight.,,,,,list1
chow_rev_low_121_10,chow,rev,low,10,121,The undead king recognized which zombie the woman had bitten during the fight.,,,,,list2
chow_rev_high_122_9,chow,rev,high,9,122,The nanny knew which housekeeper the billionaire had hired from their conversation.,,,,,list2
chow_rev_low_122_9,chow,rev,low,9,122,The nanny knew which billionaire the housekeeper had hired from their conversation.,,,,,list1
chow_rev_high_123_9,chow,rev,high,9,123,The policeman knew which suspect the detective had arrested for the recent crime.,,,,,list1
chow_rev_low_123_9,chow,rev,low,9,123,The policeman knew which detective the suspect had arrested for the recent crime.,,,,,list2
chow_rev_high_124_9,chow,rev,high,9,124,The priest knew which demon the exorcist had expelled with a cross.,,,,,list2
chow_rev_low_124_9,chow,rev,low,9,124,The priest knew which exorcist the demon had expelled with a cross.,,,,,list1
chow_rev_high_125_9,chow,rev,high,9,125,The four-year-old knew which hero the dragon had eaten for dinner last night.,,,,,list1
chow_rev_low_125_9,chow,rev,low,9,125,The four-year-old knew which dragon the hero had eaten for dinner last night.,,,,,list2
chow_rev_high_126_9,chow,rev,high,9,126,The researcher learned which whale the biologist had studied in the lab.,,,,,list2
chow_rev_low_126_9,chow,rev,low,9,126,The researcher learned which biologist the whale had studied in the lab.,,,,,list1
chow_rev_high_127_10,chow,rev,high,10,127,The military man knew which soldiers the general had promoted after their tour.,When was someone promoted?,last year,after their tour,1,list1
chow_rev_low_127_10,chow,rev,low,10,127,The military man knew which general the soldiers had promoted after their tour.,When was someone promoted?,last year,after their tour,1,list2
chow_rev_high_128_10,chow,rev,high,10,128,The judo master recognized which defender the assailant had attacked late last night.,,,,,list2
chow_rev_low_128_10,chow,rev,low,10,128,The judo master recognized which assailant the defender had attacked late last night.,,,,,list1
chow_rev_high_129_10,chow,rev,high,10,129,The committee member guessed which advisors the president had appointed to the Cabinet.,,,,,list1
chow_rev_low_129_10,chow,rev,low,10,129,The committee member guessed which president the advisors had appointed to the Cabinet.,,,,,list2
chow_rev_high_130_10,chow,rev,high,10,130,The head nun explained which friar the temptress had seduced after Sunday mass.,,,,,list3
chow_rev_low_130_10,chow,rev,low,10,130,The head nun explained which temptress the friar had seduced after Sunday mass.,,,,,list4
chow_rev_high_131_9,chow,rev,high,9,131,The naturalist observed which predators the deer had avoided by sleeping in the daytime.,When did the deer sleep?,in the daytime,at night,0,list4
chow_rev_low_131_9,chow,rev,low,9,131,The naturalist observed which deer the predators had avoided by sleeping in the daytime.,When did the predators sleep?,in the daytime,at night,0,list3
chow_rev_high_132_9,chow,rev,high,9,132,The producer observed which viewers the acrobats had impressed with their tricks.,Where did the sentence take place?,in the woods,at the circus,1,list3
chow_rev_low_132_9,chow,rev,low,9,132,The producer observed which acrobats the viewers had impressed with their tricks.,Where did the sentence take place?,in the woods,at the circus,1,list4
chow_rev_high_133_10,chow,rev,high,10,133,The parole officer confirmed which delinquent the psychologist had treated several times already.,,,,,list4
chow_rev_low_133_10,chow,rev,low,10,133,The parole officer confirmed which psychologist the delinquent had treated several times already.,,,,,list3
chow_rev_high_134_10,chow,rev,high,10,134,The police officer noted which jeweler the burglar had robbed on his spree.,,,,,list3
chow_rev_low_134_10,chow,rev,low,10,134,The police officer noted which burglar the jeweler had robbed on his spree.,,,,,list4
chow_rev_high_135_10,chow,rev,high,10,135,The restaurant owner forgot which customer the waitress had served during dinner yesterday.,Where did the sentence take place?,a zoo,a restaurant,1,list4
chow_rev_low_135_10,chow,rev,low,10,135,The restaurant owner forgot which waitress the customer had served during dinner yesterday.,Where did the sentence take place?,a zoo,a restaurant,1,list3
chow_rev_high_136_9,chow,rev,high,9,136,The columnist publicized which photographer the celebrity had punched in the nose.,Where was the photographer punched?,the nose,the stomach,0,list3
chow_rev_low_136_9,chow,rev,low,9,136,The columnist publicized which celebrity the photographer had punched in the nose.,Where was the celebrity punched?,the nose,the stomach,0,list4
chow_rev_high_137_10,chow,rev,high,10,137,The park ranger documented which eagle the hunter had shot with a rifle.,,,,,list4
chow_rev_low_137_10,chow,rev,low,10,137,The park ranger documented which hunter the eagle had shot with a rifle.,,,,,list3
chow_rev_high_138_9,chow,rev,high,9,138,The sheriff recalled which locals the gangsters had robbed in a dark alleyway.,Where did the robbery take place?,on a beach,in a dark alleyway,1,list3
chow_rev_low_138_9,chow,rev,low,9,138,The sheriff recalled which gangsters the locals had robbed in a dark alleyway.,Where did the robbery take place?,on a beach,in a dark alleyway,1,list4
chow_rev_high_139_9,chow,rev,high,9,139,The ringmaster recognized which cheetah the tamer had trained three years ago.,How long ago was the cheetah trained?,three years ago,yesterday,0,list4
chow_rev_low_139_9,chow,rev,low,9,139,The ringmaster recognized which tamer the cheetah had trained three years ago.,How long ago was the tamer trained?,three years ago,yesterday,0,list3
chow_rev_high_140_9,chow,rev,high,9,140,The queen recognized which nobleman the comedian had entertained with his jokes.,Who recognized the nobleman?,a peasant,a queen,1,list3
chow_rev_low_140_9,chow,rev,low,9,140,The queen recognized which comedian the nobleman had entertained with his jokes.,Who recognized the comedian?,a peasant,a queen,1,list4
chow_rev_high_141_9,chow,rev,high,9,141,The farmhand recorded which goats the breeder had sold at the market.,,,,,list4
chow_rev_low_141_9,chow,rev,low,9,141,The farmhand recorded which breeder the goats had sold at the market.,,,,,list3
chow_rev_high_142_9,chow,rev,high,9,142,The firefighter reported which victim the paramedic had saved after the fire.,,,,,list3
chow_rev_low_142_9,chow,rev,low,9,142,The firefighter reported which paramedic the victim had saved after the fire.,,,,,list4
chow_rev_high_143_9,chow,rev,high,9,143,The camper reported which girl the bear had mauled in the forest.,,,,,list4
chow_rev_low_143_9,chow,rev,low,9,143,The camper reported which bear the girl had mauled in the forest.,,,,,list3
chow_rev_high_144_10,chow,rev,high,10,144,The ape researcher identified which chimpanzee the poacher had shot in the jungle.,,,,,list3
chow_rev_low_144_10,chow,rev,low,10,144,The ape researcher identified which poacher the chimpanzee had shot in the jungle.,,,,,list4
chow_rev_high_145_9,chow,rev,high,9,145,The parent saw which child the lifeguard had rescued from the pool.,Where does the sentence take place?,a pool,a forest,0,list4
chow_rev_low_145_9,chow,rev,low,9,145,The parent saw which lifeguard the child had rescued from the pool.,Where does the sentence take place?,a pool,a forest,0,list3
chow_rev_high_146_9,chow,rev,high,9,146,The sailor saw which whale the man had harpooned on the starboard side.,,,,,list3
chow_rev_low_146_9,chow,rev,low,9,146,The sailor saw which man the whale had harpooned on the starboard side.,,,,,list4
chow_rev_high_147_9,chow,rev,high,9,147,The boatman saw which shark the diver had speared just off the shore.,,,,,list4
chow_rev_low_147_9,chow,rev,low,9,147,The boatman saw which diver the shark had speared just off the shore.,,,,,list3
chow_rev_high_148_10,chow,rev,high,10,148,The high schooler heard which geek the jock had bullied in the hall.,,,,,list3
chow_rev_low_148_10,chow,rev,low,10,148,The high schooler heard which jock the geek had bullied in the hall.,,,,,list4
chow_rev_high_149_9,chow,rev,high,9,149,The housekeeper showed which mouse the cat had killed under the table.,,,,,list4
chow_rev_low_149_9,chow,rev,low,9,149,The housekeeper showed which cat the mouse had killed under the table.,,,,,list3
chow_rev_high_150_9,chow,rev,high,9,150,The documentarian showed which piglets the agriculturalist had raised at the farm.,Where does the sentence take place?,a boat,a farm,1,list3
chow_rev_low_150_9,chow,rev,low,9,150,The documentarian showed which agriculturalist the piglets had raised at the farm.,Where does the sentence take place?,a boat,a farm,1,list4
chow_rev_high_151_10,chow,rev,high,10,151,The campaign volunteer speculated which mayor the voters had elected by a landslide.,Was the election won by a landslide?,yes,no,0,list4
chow_rev_low_151_10,chow,rev,low,10,151,The campaign volunteer speculated which voters the mayor had elected by a landslide.,Was the election won by a landslide?,yes,no,0,list3
chow_rev_high_152_10,chow,rev,high,10,152,The prison warden guessed which jailer the inmate had stabbed with a knife.,,,,,list3
chow_rev_low_152_10,chow,rev,low,10,152,The prison warden guessed which inmate the jailer had stabbed with a knife.,,,,,list4
chow_rev_high_153_10,chow,rev,high,10,153,The bird watcher saw which photographer the hawk had attacked in the woods.,,,,,list4
chow_rev_low_153_10,chow,rev,low,10,153,The bird watcher saw which hawk the photographer had attacked in the woods.,,,,,list3
chow_rev_high_154_8,chow,rev,high,8,154,Tracy announced which applicant the administrator had chosen after the interview.,,,,,list3
chow_rev_low_154_8,chow,rev,low,8,154,Tracy announced which administrator the applicant had chosen after the interview.,,,,,list4
chow_rev_high_155_8,chow,rev,high,8,155,Tonia explained which housewife the conman had swindled over the phone.,,,,,list4
chow_rev_low_155_8,chow,rev,low,8,155,Tonia explained which conman the housewife had swindled over the phone.,,,,,list3
chow_rev_high_156_8,chow,rev,high,8,156,Teresa knew which neighbor the parrot had bitten at the block party.,,,,,list3
chow_rev_low_156_8,chow,rev,low,8,156,Teresa knew which parrot the neighbor had bitten at the block party.,,,,,list4
chow_rev_high_157_8,chow,rev,high,8,157,Jack observed which passenger the conductor had removed from the train.,,,,,list4
chow_rev_low_157_8,chow,rev,low,8,157,Jack observed which conductor the passenger had removed from the train.,,,,,list3
chow_rev_high_158_10,chow,rev,high,10,158,The old widower remembered which villager the ghost had haunted for many years.,,,,,list3
chow_rev_low_158_10,chow,rev,low,10,158,The old widower remembered which ghost the villager had haunted for many years.,,,,,list4
chow_rev_high_159_10,chow,rev,high,10,159,The aid worker realized which refugees the philanthropist had helped to escape starvation.,,,,,list4
chow_rev_low_159_10,chow,rev,low,10,159,The aid worker realized which philanthropist the refugees had helped to escape starvation.,,,,,list3
chow_﻿sub_high_200_10,chow,sub,high,10,200,The aquarium visitor wondered which fish the penguins had eaten during the performance.,,,,,list1
chow_sub_low_200_10,chow,sub,low,10,200,The aquarium visitor wondered which trainer the penguins had eaten during the performance.,,,,,list2
chow_sub_high_201_9,chow,sub,high,9,201,The storyteller explained which dragon the prince had slain with his sword.,,,,,list2
chow_sub_low_201_9,chow,sub,low,9,201,The storyteller explained which princess the prince had slain with his sword.,,,,,list1
chow_sub_high_202_9,chow,sub,high,9,202,The superintendent overheard which tenant the landlord had evicted at the end of May.,When was someone evicted?,at the beginning of January,at the end of May,1,list1
chow_sub_low_202_9,chow,sub,low,9,202,The superintendent overheard which realtor the landlord had evicted at the end of May.,When was someone evicted?,at the beginning of January,at the end of May,1,list2
chow_sub_high_203_9,chow,sub,high,9,203,The butler speculated which guests the master had invited to the party.,Who was speculating about a party?,a butler,a nanny,0,list2
chow_sub_low_203_9,chow,sub,low,9,203,The butler speculated which servants the master had invited to the party.,Who was speculating about a party?,a butler,a nanny,0,list1
chow_sub_high_204_9,chow,sub,high,9,204,The priest mentioned which nonbeliever the nun had converted on her mission trip.,,,,,list1
chow_sub_low_204_9,chow,sub,low,9,204,The priest mentioned which archbishop the nun had converted on her mission trip.,,,,,list2
chow_sub_high_205_9,chow,sub,high,9,205,The sheriff boasted which horse the cowboy had ridden across the town.,Who rode the horse across town?,a farmer,a cowboy,1,list2
chow_sub_low_205_9,chow,sub,low,9,205,The sheriff boasted which bandit the cowboy had ridden across the town.,Who rode the bandit across town?,a farmer,a cowboy,1,list1
chow_sub_high_206_9,chow,sub,high,9,206,Stevens revealed which clerk the manager had fired for being lazy.,Why was someone fired?,for being lazy,for being late,0,list1
chow_sub_low_206_9,chow,sub,low,9,206,Stevens revealed which customer the manager had fired for being lazy.,Why was someone fired?,for being lazy,for being late,0,list2
chow_sub_high_207_10,chow,sub,high,10,207,The secret serviceman concealed which ex-president the agent had protected from the terrorists.,,,,,list2
chow_sub_low_207_10,chow,sub,low,10,207,The secret serviceman concealed which assassin the agent had protected from the terrorists.,,,,,list1
chow_sub_high_208_10,chow,sub,high,10,208,The Roman emperor asked which god the gladiator had worshipped for strength in battle.,,,,,list1
chow_sub_low_208_10,chow,sub,low,10,208,The Roman emperor asked which adversary the gladiator had worshipped for strength in battle.,,,,,list2
chow_sub_high_209_9,chow,sub,high,9,209,The author revealed which maiden the hero had saved from the tower.,,,,,list2
chow_sub_low_209_9,chow,sub,low,9,209,The author revealed which ogre the hero had saved from the tower.,,,,,list1
chow_sub_high_210_9,chow,sub,high,9,210,The columnist publicized which billionaire the supermodel had married on public television.,Did the supermodel marry a billionaire?,yes,no,0,list1
chow_sub_low_210_9,chow,sub,low,9,210,The columnist publicized which stylist the supermodel had married on public television.,Did the supermodel marry a stylist?,yes,no,0,list2
chow_sub_high_211_10,chow,sub,high,10,211,The Iranian scholar researched which camels the Persians had ridden across the desert.,,,,,list2
chow_sub_low_211_10,chow,sub,low,10,211,The Iranian scholar researched which soldiers the Persians had ridden across the desert.,,,,,list1
chow_sub_high_212_9,chow,sub,high,9,212,The beggar saw which leper the saint had cured in the street.,,,,,list1
chow_sub_low_212_9,chow,sub,low,9,212,The beggar saw which prophet the saint had cured in the street.,,,,,list2
chow_sub_high_213_9,chow,sub,high,9,213,The historian recorded which patriot the king had knighted at the ceremony.,,,,,list2
chow_sub_low_213_9,chow,sub,low,9,213,The historian recorded which traitor the king had knighted at the ceremony.,,,,,list1
chow_sub_high_214_9,chow,sub,high,9,214,The monk recalled which sinner the priest had forgiven in church yesterday.,,,,,list1
chow_sub_low_214_9,chow,sub,low,9,214,The monk recalled which cardinal the priest had forgiven in church yesterday.,,,,,list2
chow_sub_high_215_9,chow,sub,high,9,215,The scientist noted which antelope the lion had eaten for his dinner.,,,,,list2
chow_sub_low_215_9,chow,sub,low,9,215,The scientist noted which cub the lion had eaten for his dinner.,,,,,list1
chow_sub_high_216_9,chow,sub,high,9,216,The secretary confirmed which illustrator the author had hired for the new book.,,,,,list1
chow_sub_low_216_9,chow,sub,low,9,216,The secretary confirmed which readers the author had hired for the new book.,,,,,list2
chow_sub_high_217_9,chow,sub,high,9,217,The stenographer recorded which defendant the judge had sentenced to fifteen years.,How many years was the sentence?,twenty years,fifteen years,1,list2
chow_sub_low_217_9,chow,sub,low,9,217,The stenographer recorded which lawyer the judge had sentenced to fifteen years.,How many years was the sentence?,twenty years,fifteen years,1,list1
chow_sub_high_218_8,chow,sub,high,8,218,Spencer guessed which agent the actress had hired to promote her career.,Who did the actress hire to promote her career?,an agent,a stunt double,0,list1
chow_sub_low_218_8,chow,sub,low,8,218,Spencer guessed which admirer the actress had hired to promote her career.,Who did the actress hire to promote her career?,an admirer,a stunt double,0,list2
chow_sub_high_219_9,chow,sub,high,9,219,The editor listed which orphans the philanthropist had adopted from the faraway place.,,,,,list2
chow_sub_low_219_9,chow,sub,low,9,219,The editor listed which volunteers the philanthropist had adopted from the faraway place.,,,,,list1
chow_sub_high_220_9,chow,sub,high,9,220,The farmer remembered which pig the butcher had slaughtered in his kitchen.,,,,,list1
chow_sub_low_220_9,chow,sub,low,9,220,The farmer remembered which vegetarian the butcher had slaughtered in his kitchen.,,,,,list2
chow_sub_high_221_9,chow,sub,high,9,221,The homeowner asked which insects the exterminator had killed when he came over.,,,,,list2
chow_sub_low_221_9,chow,sub,low,9,221,The homeowner asked which plumber the exterminator had killed when he came over.,,,,,list1
chow_sub_high_222_9,chow,sub,high,9,222,The barkeeper knew which barmaids the regulars had tipped for their drinks.,What did the regulars tip for?,their food,their drinks,1,list1
chow_sub_low_222_9,chow,sub,low,9,222,The barkeeper knew which troublemakers the regulars had tipped for their drinks.,What did the regulars tip for?,their food,their drinks,1,list2
chow_sub_high_224_9,chow,sub,high,9,224,The historian knew which princess the king had married at the royal palace.,,,,,list2
chow_sub_low_224_9,chow,sub,low,9,224,The historian knew which prince the king had married at the royal palace.,,,,,list1
chow_sub_high_225_9,chow,sub,high,9,225,The journalist reported which opponent the politician had defeated by a wide margin.,,,,,list1
chow_sub_low_225_9,chow,sub,low,9,225,The journalist reported which voters the politician had defeated by a wide margin.,,,,,list2
chow_sub_high_226_9,chow,sub,high,9,226,The parent noticed which insects the child had collected in a jar.,,,,,list2
chow_sub_low_226_9,chow,sub,low,9,226,The parent noticed which teacher the child had collected in a jar.,,,,,list1
chow_sub_high_227_9,chow,sub,high,9,227,The scribe recorded which loyalists the monarch had rewarded for their actions.,Who rewarded the loyalists for their actions?,the monarch,the police,0,list1
